{
  "ledger_version": "1.0.0",
  "effective_at": "2026-07-17T09:20:00Z",
  "status": "approved-reproducible-evidence-ledger",
  "scope_items": [11, 12, 13, 14, 15, 16, 17, 18, 19, 20, 21, 22, 23],
  "review_protocol": {
    "owner": "Ahmad Abdullayev",
    "question": "Which finite deployment, language, administration, capability, legal, content, migration, approval and traceability decisions resolve project-foundation items 11 through 23 while preserving every supplied requirement and every unresolved activation gate?",
    "evidence_precedence": [
      "owner-supplied specifications identified by SHA-256",
      "primary legislation and official government publications",
      "standards and protocols issued by their controlling organizations",
      "official provider and registry documentation",
      "explicit owner policy for choices external evidence cannot determine"
    ],
    "selection_rule": "Include a source only when its issuing authority and proposition directly constrain at least one recorded decision; preserve the exact source identity and state the narrow proposition used.",
    "exclusion_rule": "Exclude duplicates, translations not needed for the reviewed proposition, superseded or draft material when a final source governs, secondary commentary, marketing comparisons and results that do not constrain an item 11 through 23 decision.",
    "inference_rule": "External evidence establishes requirements, protocol behavior or provider behavior; owner-selected values remain identified as project policy and no source is treated as proof of implementation, deployment, legal status or whole-site conformance.",
    "drift_rule": "A changed digest, source identity, official URL, version status, legal register, retrieval count or item citation invalidates this ledger until a new retrieval event and versioned review are approved."
  },
  "freshness_triggers": [
    {
      "id": "FT-01",
      "condition": "A recorded source URL redirects, disappears, changes authority or changes material content.",
      "required_action": "Re-retrieve from the issuing authority, record the result, compare the proposition and issue a new ledger version before relying on it."
    },
    {
      "id": "FT-02",
      "condition": "A standard, protocol, guidance document or provider document gains a revision, replacement, erratum, final successor or changed status.",
      "required_action": "Review the new status and proposition, retain the prior identity and approve any changed decision mapping."
    },
    {
      "id": "FT-03",
      "condition": "A cited law, regulation, cabinet decision, official interpretation or consolidated text is amended, repealed or replaced.",
      "required_action": "Perform a provision-level legal review, update the governance register and block affected production processing until approval."
    },
    {
      "id": "FT-04",
      "condition": "A provider region, service behavior, contract, subprocessor, transfer path, endpoint or delivery policy changes.",
      "required_action": "Repeat the service-specific location, security, privacy and operational assessment before release."
    },
    {
      "id": "FT-05",
      "condition": "A domain, environment, language, role, feature state, provider, jurisdiction, content disposition or requirement-applicability decision changes.",
      "required_action": "Re-run every affected review question and cross-artifact validation, then obtain the affected approval domains."
    },
    {
      "id": "FT-06",
      "condition": "A source reaches its next scheduled review date or an affected release is proposed first.",
      "required_action": "Re-retrieve the source and record unchanged or changed status before the deadline or release, whichever occurs first."
    },
    {
      "id": "FT-07",
      "condition": "An owner-supplied file name, byte content, page model, extraction count or digest changes.",
      "required_action": "Treat it as a new source edition, repeat complete extraction and reconciliation, and never substitute it silently."
    }
  ],
  "retrieval_events": [
    {
      "id": "EV-001",
      "executed_at": "2026-07-17T08:40:00Z",
      "method": "local-direct-retrieval",
      "sites": ["owner-supplied local filesystem"],
      "query_strings": [
        "/home/ahmad-abdullayev/Downloads/personal_academic_professional_website_srs.pdf",
        "/home/ahmad-abdullayev/Downloads/personal_academic_website_backend_specification.pdf"
      ],
      "candidate_count": 2,
      "included_count": 2,
      "excluded_count": 0,
      "included_source_ids": ["website-srs", "backend-specification"],
      "inclusion_reason": "Both files were explicitly supplied by the owner and their SHA-256 identities, page models and complete requirement populations were recorded.",
      "excluded_reasons": []
    },
    {
      "id": "EV-002",
      "executed_at": "2026-07-17T08:50:00Z",
      "method": "web-direct-retrieval",
      "sites": ["rdap.verisign.com"],
      "query_strings": [
        "HEAD https://rdap.verisign.com/com/v1/domain/ahmadabdullayev.com",
        "HEAD https://rdap.verisign.com/com/v1/domain/ahmad-abdullayev.com"
      ],
      "candidate_count": 2,
      "included_count": 2,
      "excluded_count": 0,
      "included_source_ids": [
        "REGISTRY-VERISIGN-RDAP-PRIMARY",
        "REGISTRY-VERISIGN-RDAP-HYPHENATED"
      ],
      "inclusion_reason": "Both exact .com names were checked in the authoritative registry endpoint; both returned HTTP 404 at retrieval and were retained because availability can change independently for each name.",
      "excluded_reasons": []
    },
    {
      "id": "EV-003",
      "executed_at": "2026-07-17T09:10:00Z",
      "method": "web-search",
      "sites": [
        "docs.aws.amazon.com",
        "rfc-editor.org",
        "w3.org",
        "csrc.nist.gov"
      ],
      "query_strings": [
        "site:docs.aws.amazon.com global infrastructure AWS Regions eu-central-1 Frankfurt official",
        "site:rfc-editor.org RFC 5646 BCP 47 language tags",
        "site:w3.org International HTML language declarations lang attribute",
        "site:csrc.nist.gov role based access control FAQ NIST"
      ],
      "candidate_count": 18,
      "included_count": 4,
      "excluded_count": 14,
      "included_source_ids": [
        "PROVIDER-AWS-REGIONS",
        "RFC-5646",
        "W3C-HTML-LANGUAGE",
        "NIST-RBAC"
      ],
      "inclusion_reason": "The selected results were the issuing organizations' pages that directly establish region identity, language-tag rules, HTML language declaration and the RBAC model.",
      "excluded_reasons": [
        {
          "count": 10,
          "reason": "Duplicate formats, translated copies, adjacent tutorials and subsidiary pages did not add a distinct controlling proposition."
        },
        {
          "count": 4,
          "reason": "Historical papers and implementation aids were narrower or less current than the selected issuing-authority page."
        }
      ]
    },
    {
      "id": "EV-004",
      "executed_at": "2026-07-17T09:12:00Z",
      "method": "web-search",
      "sites": [
        "docs.aws.amazon.com",
        "postgresql.org",
        "info.orcid.org",
        "crossref.org"
      ],
      "query_strings": [
        "site:docs.aws.amazon.com/ses/latest/dg data protection Amazon SES official",
        "site:postgresql.org/docs/current text search official PostgreSQL",
        "site:info.orcid.org documentation API read data record official",
        "site:crossref.org documentation retrieve metadata REST API official"
      ],
      "candidate_count": 18,
      "included_count": 3,
      "excluded_count": 15,
      "included_source_ids": [
        "PROVIDER-AWS-SES-DATA-PROTECTION",
        "POSTGRESQL-FTS",
        "CROSSREF-REST-API"
      ],
      "inclusion_reason": "The selected official pages directly define SES data-protection behavior, the current PostgreSQL full-text-search facility and Crossref metadata retrieval.",
      "excluded_reasons": [
        {
          "count": 11,
          "reason": "Adjacent security, API, type, identity and support pages duplicated or only elaborated the selected proposition."
        },
        {
          "count": 4,
          "reason": "Old-version, unrelated-service and presentation-only results were not decision-controlling evidence."
        }
      ]
    },
    {
      "id": "EV-005",
      "executed_at": "2026-07-17T09:14:00Z",
      "method": "web-search",
      "sites": ["info.orcid.org", "rfc-editor.org", "ogp.me", "iso.org"],
      "query_strings": [
        "site:info.orcid.org/documentation/api-tutorials/api-tutorial-read-data-on-a-record/ ORCID API read data record",
        "site:rfc-editor.org RFC 4287 Atom Syndication Format",
        "site:ogp.me The Open Graph protocol basic metadata",
        "site:iso.org/standard/62542 ISO 15489-1 2016 information documentation records management"
      ],
      "candidate_count": 14,
      "included_count": 3,
      "excluded_count": 11,
      "included_source_ids": ["ORCID-API-READ", "RFC-4287", "ISO-15489-1-2016"],
      "inclusion_reason": "The selected results were the provider tutorial, protocol record and standard catalogue entry directly supporting synchronization, feeds and record governance; the exact OGP page was resolved in the subsequent search.",
      "excluded_reasons": [
        {
          "count": 8,
          "reason": "Alternate RFC formats, related RFCs and ORCID navigation, search or translated pages did not replace the selected source."
        },
        {
          "count": 3,
          "reason": "Results without a distinct proposition for the reviewed decisions were excluded."
        }
      ]
    },
    {
      "id": "EV-006",
      "executed_at": "2026-07-17T09:16:00Z",
      "method": "web-search",
      "sites": ["ogp.me", "w3.org", "csrc.nist.gov", "rdap.verisign.com"],
      "query_strings": [